{
  "schemaVersion": 1,
  "theme": "j3w1-theme",
  "version": "4.0.0",
  "profile": "default",
  "sharedFiles": [
    "theme.json",
    "agents/consume.md",
    "LICENSE.md",
    "schemas/json/theme.lock.schema.json",
    "exports/theme.compact.md",
    "exports/tokens.resolved.json",
    "exports/port-capabilities.json",
    "spec/identity.md",
    "spec/foundations.md",
    "spec/accessibility.md",
    "spec/portability.md"
  ],
  "sharedTokens": [
    "border.width.default",
    "border.width.emphasis",
    "breakpoint.lg",
    "breakpoint.md",
    "breakpoint.sm",
    "breakpoint.xs",
    "color.action.destructive.border",
    "color.action.destructive.filled-bg",
    "color.action.destructive.filled-text",
    "color.action.destructive.hover-bg",
    "color.action.destructive.hover-text",
    "color.action.destructive.pressed-bg",
    "color.action.destructive.text",
    "color.action.primary.bg",
    "color.action.primary.border",
    "color.action.primary.hover-bg",
    "color.action.primary.pressed-bg",
    "color.action.primary.text",
    "color.action.secondary.bg",
    "color.action.secondary.border",
    "color.action.secondary.hover-bg",
    "color.action.secondary.pressed-bg",
    "color.action.secondary.text",
    "color.action.tertiary.hover-bg",
    "color.action.tertiary.text",
    "color.border.active",
    "color.border.control",
    "color.border.default",
    "color.border.disabled",
    "color.border.divider",
    "color.border.overlay",
    "color.border.selected-indicator",
    "color.border.selected-indicator-inactive",
    "color.border.strong",
    "color.interaction.disabled.bg",
    "color.interaction.drop-target",
    "color.interaction.focus.ring",
    "color.interaction.focus.ring-container",
    "color.interaction.hover.bg",
    "color.interaction.hover.bg-strong",
    "color.interaction.marquee",
    "color.interaction.pressed.bg",
    "color.interaction.scrollbar.thumb",
    "color.interaction.scrollbar.thumb-hover",
    "color.interaction.scrollbar.track",
    "color.interaction.selection.bg",
    "color.interaction.selection.inactive-bg",
    "color.interaction.selection.inactive-text",
    "color.interaction.selection.text",
    "color.interaction.text-selection.bg",
    "color.interaction.text-selection.text",
    "color.status.danger.border",
    "color.status.danger.fill",
    "color.status.danger.on-fill",
    "color.status.danger.text",
    "color.status.danger.tint",
    "color.status.info.border",
    "color.status.info.fill",
    "color.status.info.on-fill",
    "color.status.info.text",
    "color.status.info.tint",
    "color.status.neutral.border",
    "color.status.neutral.fill",
    "color.status.neutral.on-fill",
    "color.status.neutral.text",
    "color.status.neutral.tint",
    "color.status.success.border",
    "color.status.success.fill",
    "color.status.success.on-fill",
    "color.status.success.text",
    "color.status.success.tint",
    "color.status.warning.border",
    "color.status.warning.fill",
    "color.status.warning.on-fill",
    "color.status.warning.text",
    "color.status.warning.tint",
    "color.surface.backdrop",
    "color.surface.canvas",
    "color.surface.chrome",
    "color.surface.chrome-alt",
    "color.surface.code",
    "color.surface.default",
    "color.surface.desktop",
    "color.surface.input",
    "color.surface.overlay",
    "color.surface.raised",
    "color.surface.sunken",
    "color.surface.terminal",
    "color.text.accent",
    "color.text.accent-strong",
    "color.text.bright",
    "color.text.default",
    "color.text.disabled",
    "color.text.heading",
    "color.text.highlight",
    "color.text.inverse",
    "color.text.link",
    "color.text.link-hover",
    "color.text.link-underline",
    "color.text.muted",
    "color.text.on-action",
    "color.text.on-danger",
    "color.text.on-light",
    "color.text.on-selection",
    "color.text.placeholder",
    "color.text.prose",
    "color.text.subtle",
    "density.comfortable.control-height",
    "density.comfortable.control-padding-x",
    "density.comfortable.gap",
    "density.comfortable.icon",
    "density.comfortable.row-height",
    "density.compact.control-height",
    "density.compact.control-padding-x",
    "density.compact.gap",
    "density.compact.icon",
    "density.compact.row-height",
    "focus.offset",
    "focus.offset-container",
    "focus.offset-invalid",
    "focus.ring",
    "focus.ring-container",
    "font.family.mono",
    "font.letter-spacing.terminal",
    "font.line-height.caption",
    "font.line-height.code",
    "font.line-height.h1",
    "font.line-height.h2",
    "font.line-height.h3",
    "font.line-height.reading",
    "font.line-height.terminal",
    "font.line-height.ui-lg",
    "font.line-height.ui-md",
    "font.line-height.ui-sm",
    "font.size.caption",
    "font.size.code",
    "font.size.h1",
    "font.size.h2",
    "font.size.h3",
    "font.size.reading",
    "font.size.terminal",
    "font.size.ui-lg",
    "font.size.ui-md",
    "font.size.ui-sm",
    "font.weight.bold",
    "font.weight.regular",
    "icon.size.lg",
    "icon.size.md",
    "icon.size.sm",
    "icon.stroke",
    "layout.app-max",
    "layout.content-max",
    "layout.measure",
    "motion.duration.base",
    "motion.duration.fast",
    "motion.duration.slow",
    "radius.none",
    "shadow.floating",
    "space.0",
    "space.1",
    "space.12",
    "space.16",
    "space.2",
    "space.24",
    "space.32",
    "space.4",
    "space.48",
    "space.8",
    "z.canvas",
    "z.dialog",
    "z.drawer",
    "z.popover",
    "z.raised",
    "z.skip-link",
    "z.toast"
  ],
  "usageDigest": "sha256-ukoBP03PSt4w0/4dYqSTsEzVk6frvKAj/fUSmgRggRI=",
  "tokenDependencies": {
    "border.width.default": [],
    "border.width.emphasis": [],
    "breakpoint.lg": [],
    "breakpoint.md": [],
    "breakpoint.sm": [],
    "breakpoint.xs": [],
    "color.action.destructive.border": [
      "color.primitive.red.800"
    ],
    "color.action.destructive.filled-bg": [
      "color.primitive.red.750"
    ],
    "color.action.destructive.filled-text": [
      "color.primitive.paper.100"
    ],
    "color.action.destructive.hover-bg": [
      "color.primitive.red.750"
    ],
    "color.action.destructive.hover-text": [
      "color.primitive.paper.100"
    ],
    "color.action.destructive.pressed-bg": [
      "color.primitive.red.550"
    ],
    "color.action.destructive.text": [
      "color.primitive.red.850"
    ],
    "color.action.primary.bg": [
      "color.primitive.red.200"
    ],
    "color.action.primary.border": [
      "color.primitive.red.400"
    ],
    "color.action.primary.hover-bg": [
      "color.primitive.red.350"
    ],
    "color.action.primary.pressed-bg": [
      "color.primitive.red.150"
    ],
    "color.action.primary.text": [
      "color.text.on-action",
      "color.text.bright",
      "color.primitive.rose.800"
    ],
    "color.action.secondary.bg": [
      "color.primitive.alpha.transparent"
    ],
    "color.action.secondary.border": [
      "color.primitive.rose.350"
    ],
    "color.action.secondary.hover-bg": [
      "color.primitive.red.150"
    ],
    "color.action.secondary.pressed-bg": [
      "color.primitive.red.50"
    ],
    "color.action.secondary.text": [
      "color.primitive.rose.800"
    ],
    "color.action.tertiary.hover-bg": [
      "color.primitive.ink.40"
    ],
    "color.action.tertiary.text": [
      "color.primitive.rose.700"
    ],
    "color.border.active": [
      "color.primitive.red.800"
    ],
    "color.border.control": [
      "color.primitive.rose.350"
    ],
    "color.border.default": [
      "color.primitive.red.100"
    ],
    "color.border.disabled": [
      "color.primitive.red.200"
    ],
    "color.border.divider": [
      "color.primitive.ink.60"
    ],
    "color.border.overlay": [
      "color.primitive.red.800"
    ],
    "color.border.selected-indicator": [
      "color.primitive.red.800"
    ],
    "color.border.selected-indicator-inactive": [
      "color.primitive.red.400"
    ],
    "color.border.strong": [
      "color.primitive.red.400"
    ],
    "color.chart.axis": [
      "color.primitive.red.400"
    ],
    "color.chart.grid": [
      "color.primitive.ink.60"
    ],
    "color.chart.label": [
      "color.primitive.rose.600"
    ],
    "color.chart.series-1": [
      "color.primitive.rose.800"
    ],
    "color.chart.series-2": [
      "color.primitive.red.850"
    ],
    "color.chart.series-3": [
      "color.primitive.rose.600"
    ],
    "color.chart.series-4": [
      "color.primitive.rose.350"
    ],
    "color.code.bg": [
      "color.primitive.ink.20"
    ],
    "color.code.bracket-match": [
      "color.primitive.red.800"
    ],
    "color.code.caret": [
      "color.primitive.rose.700"
    ],
    "color.code.current-line": [
      "color.primitive.ink.40"
    ],
    "color.code.gutter-bg": [
      "color.primitive.ink.20"
    ],
    "color.code.gutter-rule": [
      "color.primitive.ink.60"
    ],
    "color.code.hued.attribute": [
      "color.primitive.amber.500"
    ],
    "color.code.hued.constant": [
      "color.primitive.amber.500"
    ],
    "color.code.hued.escape": [
      "color.primitive.amber.500"
    ],
    "color.code.hued.function": [
      "color.primitive.amber.500"
    ],
    "color.code.hued.number": [
      "color.primitive.amber.500"
    ],
    "color.code.hued.operator": [
      "color.primitive.rose.800"
    ],
    "color.code.hued.property": [
      "color.primitive.blue.500"
    ],
    "color.code.hued.string": [
      "color.primitive.green.500"
    ],
    "color.code.hued.type": [
      "color.primitive.blue.500"
    ],
    "color.code.indent-guide": [
      "color.primitive.red.100"
    ],
    "color.code.line-number": [
      "color.primitive.rose.450"
    ],
    "color.code.line-number-active": [
      "color.primitive.rose.700"
    ],
    "color.code.search-current-bg": [
      "color.primitive.rose.800"
    ],